Entry,Name,Description,Object,Legend
hsa00010,Glycolysis / Gluconeogenesis,Glycolysis is the process of converting glucose into pyruvate and generating small amounts of ATP (e...,C00033 (Acetate) C00031 (D-Glucose) C00103 (D-Glucose 1-phosphate) C00631 (2-Phospho-D-glycerate) C0...,4.1.2.13 1.2.1.3 6.2.1.13 1.2.1.5 Acetate Pentose phosphate pathway Starch and sucrose metabolism 4....
hsa00020,Citrate cycle (TCA cycle),"The citrate cycle (TCA cycle, Krebs cycle) is an important aerobic pathway for the final steps of th...",C00022 (Pyruvate) C00122 (Fumarate) C00036 (Oxaloacetate) C05379 (Oxalosuccinate) C00024 (Acetyl-CoA...,1.8.1.4 1.2.4.2 1.2.4.2 2.3.1.61 6.2.1.5 6.2.1.4 1.1.1.42 1.1.1.41 1.1.1.42 2.3.3.8 4.2.1.2 4.2.1.3 ...
hsa00030,Pentose phosphate pathway,The pentose phosphate pathway is a process of glucose turnover that produces NADPH as reducing equiv...,"C01151 (D-Ribose 1,5-bisphosphate) C00668 (alpha-D-Glucose 6-phosphate) C00118 (D-Glyceraldehyde 3-p...",2.7.4.23 5.3.1.9 4.1.2.14 Glycolysis 2.7.1.15 5.4.2.7 4.1.2.4 2.7.6.1 5.4.2.7 2.7.1.15 2.2.1.1 5.3.1...
hsa00040,Pentose and glucuronate interconversions,,C14899 (3-Dehydro-L-gulonate 6-phosphate) C03033 (beta-D-Glucuronoside) C00817 (D-Altronate) C00103 ...,3.2.1.15 3-Dehydro-L-gulonate-6P 4.1.1.85 2.7.1.53 β-D-Glucuronoside 3.2.1.31 5.3.1.4 1.1.1.13 2.7.1...
hsa00051,Fructose and mannose metabolism,,C00247 (L-Sorbose) C00267 (alpha-D-Glucose) C01094 (D-Fructose 1-phosphate) C00159 (D-Mannose) C0027...,2.7.1.202 Galactose metabolism 1.1.99.21 1.1.1.21 1.1.1.14 5.3.1.5 2.7.1.3 5.3.1.7 1.1.1.11 1.1.1.67...
hsa00052,Galactose metabolism,,C06311 (Galactitol 1-phosphate) C01216 (2-Dehydro-3-deoxy-D-galactonate) C00137 (myo-Inositol) C0009...,1.1.1.251 2.7.1.200 3.2.1.22 2.7.1.144 2.7.1.11 4.1.2.40 4.1.2.21 3.2.1.85 3.2.1.22 3.2.1.26 2.4.1.6...
hsa00053,Ascorbate and aldarate metabolism,,C00137 (myo-Inositol) C05385 (D-Glucuronate 1-phosphate) C00167 (UDP-glucuronate) C00029 (UDP-glucos...,spontaneous 4.2.1.176 3.1.1.- 1.1.1.365 1.1.1.122 3.1.3.93 2.7.7.69 5.1.3.18 5.1.3.18 5.1.3.18 1.13....
hsa00061,Fatty acid biosynthesis,,C04088 (Octadecanoyl-[acyl-carrier protein]) C16221 ((2E)-Octadecenoyl-[acp]) C16220 ((3R)-3-Hydroxy...,FabK FabK FabK FabK FabK FabK FabL Octadecanoyl-[acp] trans-Octadec-2-enoyl-[acp] (R)-3-Hydroxy-octa...
hsa00062,Fatty acid elongation,,C00024 (Acetyl-CoA) C00136 (Butanoyl-CoA) C05270 (Hexanoyl-CoA) C05271 (trans-Hex-2-enoyl-CoA) C0526...,4.2.1.74 4.2.1.74 Fatty acid degradation FATTY ACID ELONGATION 3.1.2.22 1.3.1.38 4.2.1.17 1.1.1.21...
hsa00071,Fatty acid degradation,,"C02990 (L-Palmitoylcarnitine) C00638 (Long-chain fatty acid) C05280 (cis,cis-3,6-Dodecadienoyl-CoA) ...",1.3.99.- 1.3.99.- 1.3.99.- 1.3.99.- 1.3.99.- 1.3.99.- 1.3.8.1 1.1.1.35 4.2.1.17 1.3.8.7 6.2.1.20 5.3...
hsa00100,Steroid biosynthesis,,C01673 (Calcitriol) C01561 (Calcidiol) C01902 (Cycloartenol) C05442 (Stigmasterol) C15776 (4alpha-Me...,STE1 5.3.3.5 1.3.1.21 1.14.19.20 5.3.3.5 ERG4 ERG5 ERG3 ERG2 Brassinosteroid biosynthesis Calcitriol...
hsa00120,Primary bile acid biosynthesis,Bile acids are steroid carboxylic acids derived from cholesterol in vertebrates. The primary bile ac...,"C00187 (Cholesterol) C03594 (7alpha-Hydroxycholesterol) C15610 (Cholest-5-ene-3beta,26-diol) C15519 ...",1.14.14.25 1.14.14.29 1.14.14.23 1.14.14.29 1.3.1.3 1.1.1.50 1.14.15.15 5.1.99.4 1.17.99.3 1.1.1.50 ...
hsa00130,Ubiquinone and other terpenoid-quinone biosynthesis,"Ubiquinone (UQ), also called coenzyme Q, and plastoquinone (PQ) are electron carriers in oxidative p...","C16519 (2-Succinyl-5-enolpyruvyl-6-hydroxy-3-cyclohexene-1-carboxylate) C03657 (1,4-Dihydroxy-2-naph...",UBIQUINONE AND OTHER TERPENOID-QUINONE BIOSYNTHESIS Phenylpropanoid biosynthesis 2-Succinyl-5-en...
hsa00140,Steroid hormone biosynthesis,Steroid hormones derived from cholesterol are a class of biologically active compounds in vertebrate...,"C05138 (17alpha-Hydroxypregnenolone) C05485 (21-Hydroxypregnenolone) C05489 (11beta,17alpha,21-Trihy...","1.1.1.62 STEROID HORMONE BIOSYNTHESIS 17α-Hydroxy-pregnenolone 21-Hydroxy-pregnenolone 11β,17α,21-T..."
hsa00190,Oxidative phosphorylation,,C00061 (FMN) C00390 (Ubiquinol) C00399 (Ubiquinone) C00524 (Cytochrome c) C00080 (H+) C00080 (H+) C0...,"F-type ATPase (Eukaryotes) V/A-type ATPase (Bacteria, Archaea) V-type ATPase (Eukaryotes) F-type ATP..."
hsa00220,Arginine biosynthesis,,C03406 (N-(L-Arginino)succinate) C00327 (L-Citrulline) C00062 (L-Arginine) C00077 (L-Ornithine) C001...,L-Arginosuccinate Citruline Arginine Ornithine Carbamoyl-P Aspartate Fumarate NH3 N-Acetyl-glutamate...
hsa00230,Purine metabolism,,C00117 (D-Ribose 5-phosphate) C00119 (5-Phospho-alpha-D-ribose 1-diphosphate) C03090 (5-Phosphoribos...,"1.17.4.1 PURINE METABOLISM Alanine, aspartate and glutamate metabolism Pentose phosphate pathway Th..."
hsa00232,Caffeine metabolism,,"C00385 (Xanthine) C13747 (1,7-Dimethylxanthine) C16362 (3,6,8-Trimethylallantoin) C16363 (N-Methylur...","Xanthine Paraxanthine 3,6,8-Trimethyl-allantoin N-Methylurea Glyoxylate N,N'-Dimethylurea 1-Methylur..."
hsa00240,Pyrimidine metabolism,,C00064 (L-Glutamine) C00438 (N-Carbamoyl-L-aspartate) C00169 (Carbamoyl phosphate) C00337 ((S)-Dihyd...,1.17.4.1 2.7.4.22 3.5.4.30 2.1.1.148 L-Glutamine 6.3.5.5 PYRIMIDINE METABOLISM Pentose phosphate pa...
hsa00250,"Alanine, aspartate and glutamate metabolism",,C00122 (Fumarate) C00042 (Succinate) C00036 (Oxaloacetate) C00026 (2-Oxoglutarate) C00041 (L-Alanine...,Fumarate Succinate Oxaloacetate 2-Oxo-glutarate Citrate cycle L-Alanine L-Aspartate L-Asparagine D-A...
hsa00260,"Glycine, serine and threonine metabolism","Serine is derived from 3-phospho-D-glycerate, an intermediate of glycolysis [MD:M00020], and glycine...","C16432 (5-Hydroxyectoine) C06231 (Ectoine) C06442 (N(gamma)-Acetyldiaminobutyrate) C03283 (L-2,4-Dia...","1.1.3.17 5.1.1.18 5-Hydroxy-ectoine 1.14.11.55 1.14.15.7 L-Ectoine Nγ-Acetyl-L-2,4-diaminobutyrate L..."
hsa00270,Cysteine and methionine metabolism,Cysteine and methionine are sulfur-containing amino acids. Cysteine is synthesized from serine throu...,C06547 (Ethylene) C01234 (1-Aminocyclopropane-1-carboxylate) C08276 (3-(Methylthio)propanoate) C1560...,Glycolysis 2.5.1.- Ethylene 1-Aminocyclopropane-1-carboxylate 1.14.17.4 4.4.1.14 2.6.1.117 3-Methyl...
hsa00280,"Valine, leucine and isoleucine degradation",,C15978 (2-Methyl-1-hydroxybutyl-ThPP) C15973 (Enzyme N6-(dihydrolipoyl)lysine) C15973 (Enzyme N6-(di...,2-Methyl-1-hydroxybutyl-ThPP 1.2.4.4 1.8.1.4 Dihydro-lipoamide-E Dihydro-lipoamide-E Lipoamide-E Lip...
hsa00290,"Valine, leucine and isoleucine biosynthesis",,C00188 (L-Threonine) C06032 (D-erythro-3-Methylmalate) C02226 (2-Methylmaleate) C02612 ((R)-2-Methyl...,2.3.3.21 4.2.1.35 1.1.1.85 4.3.1.19 Threonine D-erythro-3-Methylmalate 2-Methyl-maleate (R)-2-Methyl...
hsa00310,Lysine degradation,,"C05825 (2-Amino-5-oxohexanoate) C05161 ((2R,5S)-2,5-Diaminohexanoate) C00877 (Crotonoyl-CoA) C01144 ...","2.6.1.21 2-Amino-5-oxohexanoate 2,5-Diaminohexanoate 1.4.1.12 5.4.3.3 1.5.1.1 1.5.1.8 1.5.1.10 Penic..."
hsa00330,Arginine and proline metabolism,,C04137 (Octopine) C00062 (L-Arginine) C00077 (L-Ornithine) C00134 (Putrescine) C00555 (4-Aminobutyra...,1.5.1.11 Octopine OoxAB ARGININE AND PROLINE METABOLISM Polyamine Pathway ADC pathway ADH pathway...
hsa00340,Histidine metabolism,,C00119 (5-Phospho-alpha-D-ribose 1-diphosphate) C02739 (1-(5-Phospho-D-ribosyl)-ATP) C02741 (Phospho...,1.14.13.- 3.5.3.13 3.5.1.68 3.5.3.8 2.1.2.5 3.5.2.7 4.2.1.49 4.3.1.3 3.4.13.5 2.1.1.22 3.4.13.18 6.3...
hsa00350,Tyrosine metabolism,,"C00146 (Phenol) C02515 (3-Iodo-L-tyrosine) C01060 (3,5-Diiodo-L-tyrosine) C02465 (Triiodothyronine) ...",TYROSINE METABOLISM 1.14.18.1 4.1.99.2 1.10.3.1 Phenol 1.11.1.8 1.11.1.8 1.11.1.8 1.11.1.8 3-Iodo-L...
hsa00360,Phenylalanine metabolism,,C12621 (trans-3-Hydroxycinnamate) C00084 (Acetaldehyde) C00022 (Pyruvate) C03589 (4-Hydroxy-2-oxopen...,"4.1.3.39 4.3.1.25 Tropane, piperidine and pyridine alkaloid biosynthesis 1.2.1.5 6.2.1.30 2.3.1.14 4..."
hsa00380,Tryptophan metabolism,,"C05663 (6-Hydroxykynurenate) C05639 (4,6-Dihydroxyquinoline) C05652 (4-(2-Amino-5-hydroxyphenyl)-2,4...",1.11.1.6 1.1.1.35 1.13.11.52 4.1.1.74 Nicotinamide metabolism 2.6.1.27 1.4.3.2 1.13.11.52 1.14.14.1 ...
hsa00400,"Phenylalanine, tyrosine and tryptophan biosynthesis",,C00279 (D-Erythrose 4-phosphate) C00074 (Phosphoenolpyruvate) C04691 (2-Dehydro-3-deoxy-D-arabino-he...,Shikimate pathway 2.5.1.54 Phenylpropanoid biosynthesis Phenylpropanoid biosynthesis Biosynthesis of...
hsa00410,beta-Alanine metabolism,,"C00429 (5,6-Dihydrouracil) C02642 (3-Ureidopropionate) C00099 (beta-Alanine) C00083 (Malonyl-CoA) C0...",β-ALANINE METABOLISM Propanoate metabolism Fatty acid biosynthesis Pantothenate and CoA biosynthesi...
hsa00430,Taurine and hypotaurine metabolism,,C00094 (Sulfite) C06735 (Aminoacetaldehyde) C00041 (L-Alanine) C00022 (Pyruvate) C00227 (Acetyl phos...,1.14.11.17 Sulfur metabolism 1.1.2.- 1.4.1.1 Sulfite Aminoacetaldehyde L-Alanine Pyruvate 2.3.1.8 Ac...
hsa00440,Phosphonate and phosphinate metabolism,"Natural products containing carbon-phosphorous bonds, so-called C-P compounds, are derivatives of ph...",C00074 (Phosphoenolpyruvate) C02798 (3-Phosphonopyruvate) C05672 (2-Amino-3-phosphonopropanoate) C17...,PHOSPHONATE AND PHOSPHINATE METABOLISM Glycolysis Phosphoenol-pyruvate 3-Phosphono-pyruvate Phosp...
hsa00450,Selenocompound metabolism,,C01528 (Hydrogen selenide) C05697 (Selenate) C05684 (Selenite) C05172 (Selenophosphoric acid) C06481...,SELENOCOMPOUND METABOLISM 1.8.1.9 2.7.9.3 2.1.1.12 4.4.1.11 6.1.1.10 Hydrogen selenide Selenate Sel...
hsa00470,D-Amino acid metabolism,,C00064 (L-Glutamine) C00819 (D-Glutamine) C03933 (5-D-Glutamyl-D-glutamyl-peptide) C00025 (L-Glutama...,D-AMINO ACID METABOLISM 2.3.2.1 4.2.1.48 1.4.3.7 5.1.1.3 3.5.1.38 3.5.1.35 3.5.1.2 L-Glutamine D-Gl...
hsa00480,Glutathione metabolism,,C00024 (Acetyl-CoA) C00151 (L-Amino acid) C01879 (5-Oxoproline) C00097 (L-Cysteine) C00025 (L-Glutam...,Acetyl-CoA GLUTATHIONE METABOLISM Glutamate metabolism Taurine and hypotaurine metabolism Cyanoami...
hsa00500,Starch and sucrose metabolism,,C00092 (D-Glucose 6-phosphate) C00092 (D-Glucose 6-phosphate) C00095 (D-Fructose) C05731 (3-Ketosucr...,3.6.1.- D-Glucose-6P 3.2.1.21 3.2.1.21 2.7.1.1 3.2.1.122 STARCH AND SUCROSE METABOLISM 3.2.1.26 2...
hsa00510,N-Glycan biosynthesis,N-glycans or asparagine-linked glycans are major constituents of glycoproteins in eukaryotes. N-glyc...,G10596 G00022 G00021 G00020 G00019 G00018 (DS 3) G00017 G00016 G00015 G00014 G00013 G00012 G00011 G0...,ALG14 DPM3 DPM2 Various types of N-glycan biosynthesis ALG6 ALG12 ALG9 ALG3 N-glycan degradation MGA...
hsa00511,Other glycan degradation,,"10825 (NEU3), 129807 (NEU4), 4758 (NEU1), 4759 (NEU2) 2720 (GLB1) 23324 (MAN2B2), 4123 (MAN2C1), 412...",OTHER GLYCAN DEGRADATION GlcNAc GlcNAc Fuc Neu5Ac Gal Asn Man GlcNAc Neu5Ac Gal Man GlcNAc Man Glc...
hsa00512,Mucin type O-glycan biosynthesis,O-glycans are a class of glycans that modify serine or threonine residues of proteins. Biosynthesis ...,G00034 G00033 G00032 G00031 G00030 G00029 G00028 G00027 G00026 G00025 G00023 (Tn antigen) G00035 (Si...,Keratan sulfate biosynthesis Core 8 Core 7 (F1α) Core 6 Core 5 Core 4 Core 3 (disialyl-T antigen) (s...
hsa00513,Various types of N-glycan biosynthesis,,G11040 G10841 G01813 G12625 G12626 G00012 G00011 G13047 G13048 G13049 G13050 G00016 G00017 G10716 G1...,MNN1 N-Glycan biosynthesis MNN9 ANP1 MNN2 MNN1 MNN6 MNN11 VAN1 MAN1A MNN9 OCH1 MNN5 HOC1 MNN10 VARIO...
hsa00514,Other types of O-glycan biosynthesis,"O-linked glycosylation is the attachment of monosaccharides to the hydroxyl groups of amino acids, m...","23127 (COLGALT2), 79709 (COLGALT1), 8985 (PLOD3) 145173 (B3GLCT) 8985 (PLOD3) 6480 (ST6GAL1), 6487 (...",OTHER TYPES OF O-GLYCAN BIOSYNTHESIS Glc Hydroxylysine Glc Gal O-linked Gal type O-linked GlcNAc...
hsa00515,Mannose type O-glycan biosynthesis,Biosynthesis of mammalian O-mannosyl glycans is initiated by the transfer of mannose from mannose-P-...,C02189 ([Protein]-L-serine) G10617 (Dolichyl phosphate D-mannose) G13082 G13027 G13026 G13085 G13088...,2.4.1.- -Ser/Thr-peptide Manβ-P-Dol 2.4.1.109 POMT1/POMT2 2.4.1.- GalT POMGNT1 2.4.3.6 2.4.1.135 Sia...
hsa00520,Amino sugar and nucleotide sugar metabolism,,C00357 (N-Acetyl-D-glucosamine 6-phosphate) C00140 (N-Acetyl-D-glucosamine) C04501 (N-Acetyl-alpha-D...,2.7.1.59 5.4.2.3 2.7.7.23 3.2.1.183 2.7.1.60 2.5.1.57 3.1.3.29 3.5.99.6 3.5.1.25 5.4.2.10 2.3.1.157 ...
hsa00524,"Neomycin, kanamycin and gentamicin biosynthesis",,C00031 (D-Glucose) C00092 (D-Glucose 6-phosphate) C17209 (2-Deoxy-scyllo-inosose) C17580 (2-Deoxy-sc...,"NEOMYCIN, KANAMYCIN AND GENTAMICIN BIOSYNTHESIS D-Glucose D-Glucose-6P 2-Deoxy-scyllo-inosose 2-..."
hsa00531,Glycosaminoglycan degradation,,G01391 G13074 G13073 G01977 G01945 G02632 G09660 G13040 G13039 G13038 G13037 G13036 G13035 G13034 G0...,3.10.1.1 HPSE2 HPSE Heparan sulfate biosynthesis Keratan sulfate biosynthesis Chondroitin sulfate bi...
hsa00532,Glycosaminoglycan biosynthesis - chondroitin sulfate / dermatan sulfate,Glycosaminoglycans (GAGs) are linear polysaccharide chains consisting of repeating disaccharide unit...,"C00054 (Adenosine 3',5'-bisphosphate) C00053 (3'-Phosphoadenylyl sulfate) G00160 G00159 G00158 G0015...",PAP PAPS 2.4.1.135 2.4.2.26 2.4.1.133 GLYCOSAMINOGLYCAN BIOSYNTHESIS - CHONDROITIN SULFATE / DERMA...
hsa00533,Glycosaminoglycan biosynthesis - keratan sulfate,"Keratan sulfate (KS) is a glycosaminoglycan with the basic disaccharide unit of N-acetyllactosamine,...","10678 (B3GNT2) 2683 (B4GALT1), 8703 (B4GALT3), 8704 (B4GALT2) 6487 (ST3GAL3) 2683 (B4GALT1), 8703 (B...",Keratan sulfate II (KSII) O-Glycan biosynthesis GLYCOSAMINOGLYCAN BIOSYNTHESIS - KERATAN SULFATE K...
hsa00534,Glycosaminoglycan biosynthesis - heparan sulfate / heparin,Heparan sulfate (HS) and heparin (Hep) are glycosaminoglycans with repeating disaccharide units that...,"G00164 G00163 G00162 G00157 C00054 (Adenosine 3',5'-bisphosphate) G00156 G00155 G00154 C02189 ([Prot...","2.4.1.223 EXTL2,3 EXTL1,3 EXT1,2 EXT1,2 GlcNAc GlcNAc GlcA GlcA Gal Gal Xyl Ser EXT1,2 EXTL1,3 XYLT..."
hsa00561,Glycerolipid metabolism,,"C00422 (Triacylglycerol) C00641 (1,2-Diacyl-sn-glycerol) C00111 (Glycerone phosphate) C00093 (sn-Gly...",2.3.1.158 SQD1 SQD2 2.4.1.241 2.4.3.5 Glycerophospholipid metabolism 3.1.1.3 2.3.1.20 2.4.1.46 2.4.1...
hsa00562,Inositol phosphate metabolism,,"C11557 (1-Phosphatidyl-1D-myo-inositol 5-phosphate) C11555 (1D-myo-Inositol 1,4,5,6-tetrakisphosphat...","1-Phosphatidyl-1D-myo-inositol-5P 2.7.1.149 1D-myo-Inositol- 1,4,5,6P 3.1.3.36 2.7.1.151 2.7.1.151 3..."
hsa00563,Glycosylphosphatidylinositol (GPI)-anchor biosynthesis,Cell surface proteins can be attached to the cell membrane via the glycolipid structure called glyco...,G13150 G12396 (6-(alpha-D-glucosaminyl)-1D-myo-inositol) G00145 G00143 G00144 G00146 G13151 G13128 C...,PIG-Y DPM2 PIG-Q PIG-P PIG-H PIG-C PIG-X PIG-U PIG-T PIG-S 6-(α-D-Glucosaminyl)-1D-myo-inositol PIG-...
hsa00564,Glycerophospholipid metabolism,,"C06771 (Triethanolamine) C06772 (Diethanolamine) C00084 (Acetaldehyde) C00641 (1,2-Diacyl-sn-glycero...",Ether lipid metaboilsm 2.7.8.29 Ptdss1 Glycolysis 1.1.3.21 GPI-anchor biosynthesis Triethanolamine D...
hsa00565,Ether lipid metabolism,,C15647 (2-Acyl-1-(1-alkenyl)-sn-glycero-3-phosphate) C15646 (1-(1-Alkenyl)-sn-glycero-3-phosphate) C...,2-Acyl-1-(1-alkenyl)-sn-glycero-3-phosphate (Plasmenic acid) 1-(1-Alkenyl)-sn-glycero-3-phosphate 1-...
hsa00590,Arachidonic acid metabolism,,C03577 (20-Hydroxyleukotriene E4) C14811 (Trioxilin B3) C14809 (Trioxilin A3) C14810 (Hepoxilin B3) ...,Eicosanoids 3.3.2.10 3.3.2.10 3.3.2.10 3.3.2.10 1.14.13.34 20-OH-LTE Trioxilin B Trioxilin A Hepoxil...
hsa00591,Linoleic acid metabolism,,"C04717 ((9Z,11E)-(13S)-13-Hydroperoxyoctadeca-9,11-dienoic acid) C14833 (9,12,13-TriHOME) C14832 (12...","3.3.2.- 3.3.2.- CYP1A2 13(S)-HPODE 9,12,13-TriHOME 12,13-Epoxy-9-hydroxy-10-octadecenoate 9-OxoODE 1..."
hsa00592,alpha-Linolenic acid metabolism,,C11512 (Methyl jasmonate) C16318 ((+)-7-Isomethyljasmonate) C08491 ((-)-Jasmonic acid) C16317 ((+)-7...,MFP2 MFP2 MFP2 HPL1 ACX ACX 2.3.1.16 2.3.1.16 4.2.1.92 1.13.11.12 (-)-Methyl-jasmonate (+)-7-Isometh...
hsa00600,Sphingolipid metabolism,,C00836 (Sphinganine) C12144 (Phytosphingosine) C12145 (Phytoceramide) C12126 (Dihydroceramide) C0129...,YDC1 YPC1 2.7.8.3 3.1.3.- 3.1.3.- 3.1.3.- 3.5.1.23 3.5.1.23 CERS 1.14.19.17 LAG1 1.14.18.5 1.14.18.5...
hsa00601,Glycosphingolipid biosynthesis - lacto and neolacto series,,"G00078 (iso-nLc8Cer) G00057 G00090 (V3Fuc,III3Fuc-nLc6Cer) G00091 G00089 (V3Fuc-nLc6Cer) G00088 (VI3...",2.4.1.152 2.4.1.152 2.4.1.152 2.4.1.152 2.4.1.- 2.4.1.65 2.4.1.65 2.4.1.65 2.4.1.65 2.4.1.65 B4GALT4...
hsa00603,Glycosphingolipid biosynthesis - globo and isoglobo series,,G00181 (Disialosylglobopentaosylceramide) G00096 (IV3GalNAcb-Gb4Cer) G00100 (V3(NeuAc)2-Gb5Cer) G001...,2.4.3.2 (SSEA-4) (SSEA-3) B3GALT5 2.4.1.- 3.2.1.49 2.4.1.228 Globoside (P antigen) 3.2.1.52 2.4.1.- ...
hsa00604,Glycosphingolipid biosynthesis - ganglio series,,G00129 (GQ1balpha) G00128 (GT1aalpha) G00127 (GD1a) G00132 (GD1beta) G00131 (GM1alpha) G00130 (GM2al...,2.4.3.2 3.2.1.23 3.2.1.52 Siat8a GQ1bα GT1aα GD1α GD1β GM1α GM2α O-Acetylated GT3 GP1c GQ1c GT1c GT2...
hsa00620,Pyruvate metabolism,,C15973 (Enzyme N6-(dihydrolipoyl)lysine) C15972 (Enzyme N6-(lipoyl)lysine) C16255 ([Dihydrolipoyllys...,"PYRUVATE METABOLISM Nicotinate and nicotinamide metabolism 1.2.4.1 Citrate cycle Glycine, serine an..."
hsa00630,Glyoxylate and dicarboxylate metabolism,,"C00898 ((R,R)-Tartaric acid) C00036 (Oxaloacetate) C00158 (Citrate) C00149 ((S)-Malate) C04348 (L-Ma...",5.3.1.22 4.2.1.3 2.2.1.5 2.3.3.12 2.3.3.7 4.1.3.13 4.1.3.16 4.1.3.1 3.5.1.68 3.5.1.56 3.5.1.49 3.5.1...
hsa00640,Propanoate metabolism,,C00222 (3-Oxopropanoate) C00804 (Propynoate) C01013 (3-Hydroxypropanoate) C00099 (beta-Alanine) C000...,PROPANOATE METABOLISM 1.2.1.18 2.1.3.1 6.4.1.2 4.1.1.9 1.2.1.75 2.6.1.18 2.6.1.19 1.1.1.59 4.2.1.27...
hsa00650,Butanoate metabolism,,"C03046 ((S,S)-Butane-2,3-diol) C01769 ((S)-Acetoin) C00810 ((R)-Acetoin) C03044 ((R,R)-Butane-2,3-di...",Biosynthesis of type II polyketide backbone 4.2.1.27 1.1.1.30 3.1.1.22 2.8.3.5 6.2.1.16 4.1.3.4 2.3....
hsa00670,One carbon pool by folate,,"C00504 (Folate) C00415 (Dihydrofolate) C03479 (Folinic acid) C00143 (5,10-Methylenetetrahydrofolate)...",ONE CARBON POOL BY FOLATE Folate biosynthesis 2.1.2.5 2.1.2.4 2.1.2.2 4.3.1.4 1.5.1.15 1.5.1.3 1...
hsa00730,Thiamine metabolism,,C00082 (L-Tyrosine) C15809 (Iminoglycine) C11437 (1-Deoxy-D-xylulose 5-phosphate) C15814 (Thiocarbox...,L-Tyrosine Iminoglycine 1-Deoxy-D-xylulose 5-phosphate [ThiS]-COSH [ThiS]-CO-AMP [IscS]-SSH [IscS]-S...
hsa00740,Riboflavin metabolism,,"C15556 (L-3,4-Dihydroxybutan-2-one 4-phosphate) C00199 (D-Ribulose 5-phosphate) C00044 (GTP) C01304 ...","3,4-Dihydroxy-2-butanone 4-phosphate Ribulose 5-phosphate Pentose phosphate pathway RIBOFLAVIN META..."
hsa00750,Vitamin B6 metabolism,,C00118 (D-Glyceraldehyde 3-phosphate) C00117 (D-Ribose 5-phosphate) C07335 (2-Amino-3-oxo-4-phosphon...,D-Glyceraldehyde 3-phosphate D-Ribose 5-phosphate 4.3.3.6 Glycolysis Pentose phosphate pathway 2-Ami...
hsa00760,Nicotinate and nicotinamide metabolism,,"C06178 (1-Methylpyrrolinium) C15523 (2,6-Dihydroxynicotinate) C00022 (Pyruvate) C00163 (Propanoate) ...",Pyruvate metabolism C5-Branched dibasic acid metabolism 4.1.3.32 4.2.1.85 5.3.3.6 5.4.99.4 1.1.1.291...
hsa00770,Pantothenate and CoA biosynthesis,,"C03688 (Apo-[acyl-carrier-protein]) C00022 (Pyruvate) C04272 ((R)-2,3-Dihydroxy-3-methylbutanoate) C...","Apo-[acp] PANTOTHENATE AND CoA BIOSYNTHESIS Alanine, aspartate and glutamate metabolism Propanoate m..."
hsa00780,Biotin metabolism,"Biotin (vitamin H or vitamin B7) is the essential cofactor of biotin-dependent carboxylases, such as...",C02656 (Pimelate) C01063 (Pimeloyl-CoA) C01092 (8-Amino-7-oxononanoate) C01909 (Dethiobiotin) C01037...,"Tropane, piperidine and pyridine alkaloid biosynthesis BIOTIN METABOLISM Lysine degradation Pimelat..."
hsa00785,Lipoic acid metabolism,,C16241 ((R)-Lipoate) C16238 (Lipoyl-AMP) C22160 ([Lipoyl-carrier protein E2]-N6-octanoyl-L-lysine) C...,2.3.1.181 LIPOIC ACID METABOLISM Fatty acid biosynthesis 2.8.1.8 2.3.1.181 ( Biosynthesis ) ( Salv...
hsa00790,Folate biosynthesis,,"C11355 (4-Amino-4-deoxychorismate) C00251 (Chorismate) C00044 (GTP) C04895 (7,8-Dihydroneopterin 3'-...",4-Amino-4-deoxychorismate Chorismate FOLATE BIOSYNTHESIS One carbon pool by folate Purine metabolis...
hsa00830,Retinol metabolism,,C05917 (Iodopsin) C00473 (Retinol) C00376 (Retinal) C02094 (beta-Carotene) C00777 (Retinoate) C02075...,Iodopsin RETINOL METABOLISM all-trans-Retinol (Vitamine A) ADH all-trans-Retinal 1.13.11.63 β...
hsa00860,Porphyrin metabolism,Porphyrins are a group of chemical compounds with the backbone ring structure consisting of four lin...,C05774 (Cobinamide) C16243 (Cobalt-precorrin 5B) C16244 (Cobalt-precorrin 7) C15670 (Heme A) C15672 ...,"Ala, Asp and Glu metabolism 3.1.1.82 Cobinamide Co-precorrin 5B Co-precorrin 7 Heme A Heme O Glycine..."
hsa00900,Terpenoid backbone biosynthesis,"Terpenoids, also known as isoprenoids, are a large class of natural products consisting of isoprene ...","C05859 (ditrans,polycis-Polyprenyl diphosphate) C06081 (Polyprenol) C00022 (Pyruvate) C00024 (Acetyl...","MEP/DOXP pathway Mevalonate pathway Dehydro dolichol-PP ditrans,polycis-Polyprenol Glycolysis TERPEN..."
hsa00910,Nitrogen metabolism,The biological process of the nitrogen cycle is a complex interplay among many microorganisms cataly...,C00058 (Formate) C00488 (Formamide) C00014 (Ammonia) C00192 (Hydroxylamine) C06058 (Nitroalkane) C00...,Formate Formamide 3.5.1.49 Ammonia Hydroxylamine Nitroalkane 1.7.2.6 1.9.6.1 1.7.99.- 1.7.7.2 1.13.1...
hsa00920,Sulfur metabolism,Sulfur is an essential element for life and the metabolism of organic sulfur compounds plays an impo...,C00059 (Sulfate) C00094 (Sulfite) C00283 (Hydrogen sulfide) C00224 (Adenylyl sulfate) C00054 (Adenos...,SULFUR METABOLISM Sulfate Sulfite 1.8.2.1 1.8.3.1 1.8.7.1 1.8.99.5 1.8.1.2 Asr Sulfide 3.1.3.7 2.7....
hsa00970,Aminoacyl-tRNA biosynthesis,,C06113 (L-Aspartyl-tRNA(Asn)) C02992 (L-Threonyl-tRNA(Thr)) C02839 (L-Tyrosyl-tRNA(Tyr)) C00078 (L-T...,L-Aspartyl-tRNA(Asn) 6.1.1.5 AMINOACYL-tRNA BIOSYNTHESIS 6.1.1.22 6.1.1.21 6.1.1.20 6.1.1.19 6.1.1....
hsa00980,Metabolism of xenobiotics by cytochrome P450,,"C14039 (1,1-Dichloroethylene) C14876 (S-(2-Hydroxyethyl)-N-acetyl-L-cysteine) C14875 (S-(2-Hydroxyet...","1,1-Dichloro-ethylene CYP2E1 CYP2E1 CYP2E1 CYP2E1 CYP2E1 S-(2-Hydroxyethyl)-N-acetyl-L-cysteine S-(2..."
hsa00982,Drug metabolism - cytochrome P450,,"C16544 (alpha-Hydroxytamoxifen) D00343 (Ifosfamide (JAN/USP/INN)), C07047 (Ifosfamide) C16612 (Cital...",α-Hydroxytamoxifen Ifosfamide (prodrug) Citalopram-aldehyde 4-Ene-VPA 4-OH-VPA 5-OH-VPA Oxcarbazepin...
hsa00983,Drug metabolism - other enzymes,,"D00346 (Isoniazid (JP18/USP/INN)), C07054 (Isoniazid) C04646 (6-Thioinosine-5'-monophosphate) D01223...",Isoniazid 6-Thioinosine-5'-monophosphate Capecitabine Isonicotinic acid DRUG METABOLISM - OTHER ENZ...
hsa01040,Biosynthesis of unsaturated fatty acids,,"C16533 ((13Z,16Z)-Docosadienoic acid) C16645 ((13Z,16Z)-Docosadienoyl-CoA) C16645 ((13Z,16Z)-Docosad...","Docosadienoic acid Δ13,16 Δ13,16 3.1.2.- YciA TesB 3.1.2.- 3.1.2.- 3.1.2.- 3.1.2.- 3.1.2.- 3.1.2.- 3..."
hsa01100,Metabolic pathways,,C22651 (Dodecapentaenoyl-[acyl-carrier protein]) C09668 (Fumagillin) C22650 (Prefumagillin) C22666 (...,Monoterpenoid biosynthesis One carbon pool by folate Flavonoid biosynthesis Starch and sucrose metab...
hsa01200,Carbon metabolism,Carbon metabolism is the most basic aspect of life. This map presents an overall view of central car...,"C00085 (D-Fructose 6-phosphate), C05345 (beta-D-Fructose 6-phosphate) C01182 (D-Ribulose 1,5-bisphos...","HCO HCHO HCHO HCO HCO AcCoA CARBON METABOLISM Fructose-6P Ribulose-1,5P Glycerate-3P THF Glucose Gl..."
hsa01210,2-Oxocarboxylic acid metabolism,"2-Oxocarboxylic acids, also called 2-oxo acids and alpha-keto acids, are the most elementary set of ...",C17254 (8-Methylthiooctyl glucosinolate) C17232 (2-Oxo-10-methylthiodecanoic acid) C17252 (7-Methylt...,8-Methylthiooctyl glucosinolate 2-Oxo-10-methylthio-decanoic acid 7-Methylthioheptyl glucosinolate 2...
hsa01212,Fatty acid metabolism,,C00024 (Acetyl-CoA) C03939 (Acetyl-[acyl-carrier protein]) C05744 (Acetoacetyl-[acp]) C04618 ((3R)-3...,FATTY ACID METABOLISM Acetyl-CoA Acetyl-[acp] Malonyl-CoA Malonyl-[acp] Butanoyl-[acp] (AcACP) (Ma...
hsa01230,Biosynthesis of amino acids,"This map presents a modular architecture of the biosynthesis pathways of twenty amino acids, which m...","C04390 (N6-Acetyl-LL-2,6-diaminoheptanedioate) C04002 ((Z)-But-1-ene-1,2,4-tricarboxylate) C00118 (D...",BIOSYNTHESIS OF AMINO ACIDS Glyceraldehyde-3P Glycerone-P Glycerate-3P Phosphoenolpyruvate Pyruva...
hsa01232,Nucleotide metabolism,,C00130 (IMP) C00104 (IDP) C00081 (ITP) C00020 (AMP) C00008 (ADP) C00002 (ATP) C00294 (Inosine) C0021...,IMP IDP ITP AMP ADP ATP Inosine Adenosine Adenine Hypoxanthine Guanine GDP GMP Guanosine GTP Xanthin...
hsa01240,Biosynthesis of cofactors,,C00118 (D-Glyceraldehyde 3-phosphate) C00197 (3-Phospho-D-glycerate) C00074 (Phosphoenolpyruvate) C0...,BIOSYNTHESIS OF COFACTORS Glycer-aldehyde-3P Glycerate-3P Phosphoenol-pyruvate Pyruvate Fructose-6...
hsa01250,Biosynthesis of nucleotide sugars,,C04501 (N-Acetyl-alpha-D-glucosamine 1-phosphate) C01170 (UDP-N-acetyl-D-mannosamine) C06240 (UDP-N-...,BIOSYNTHESIS OF NUCLEOTIDE SUGARS GlcNAc-1P UDP-ManNAc UDP-ManNAcA UDP-L-6dTalNAc UDP-L-FucNAc UD...
